reference_path,summary_content,tags,transcript_content
C:/Users/G/Documents/GitHub/audycje.com.pl/content/audio\CJG_02_2023_01_21.mp3,"**1. Key Themes**
   - The text discusses the current state of the cinema industry, highlighting significant losses incurred by major studios and the impact of big-budget productions on audience expectations and satisfaction.
   - It also touches upon the manipulation of public opinion by powerful companies, which can lead to a disconnect between perceived success and actual reception by viewers and independent experts.
   - The text explores the broader implications of these trends on mass culture and the economy.

**2. Impacts**
   - **Economic**: Major studios are facing significant losses from big-budget productions, leading to a potential decline in market value and investment opportunities.
   - **Technological**: The text does not directly address technological impacts, but it implies that advancements in production quality do not necessarily translate into better audience reception.
   - **Political**: There is no direct political impact discussed, though the manipulation of public opinion by powerful entities can have broader societal consequences.
   - **Social**: The text highlights a growing disconnect between the corporate narrative and the views of ordinary viewers and independent experts, which can erode trust in mainstream media and cultural institutions.

**3. Examples and Evidence**
   - The example of ""Rings of Power"" from Tolkien's world illustrates how a highly anticipated and expensive production can fail to meet audience expectations despite being marketed as successful.
   - The series based on Sapkowski's Witcher universe is another case where corporate interference led to a poor reception by fans, who saw it as mocking the original work.

**4. Opportunities and Risks**
   - **Opportunities**: There is an opportunity for independent creators and smaller studios to gain traction if they focus on quality and authenticity rather than massive budgets.
   - **Risks**: The current trend could lead to a further decline in the cinema industry, affecting jobs and economic stability. It also risks eroding public trust in media and cultural institutions due to perceived manipulation.

**5. Conclusion**
   - The text suggests that the cinema industry is at a crossroads where the focus on massive budgets and corporate narratives may not align with audience expectations and values.
   - Future considerations should prioritize authenticity, genuine storytelling, and respect for viewers' intelligence to restore trust and ensure the longevity of the industry.","['tesla', 'Tesla', 'China', 'Cinema', 'Finance', 'radio', 'cinema', 'Crisis', 'Culture', 'products', 'cars', 'China', 'Cinema', 'Books', 'Crisis', 'Movies', 'Market', 'Wealth', 'economics', 'success', 'Economics', 'investors', 'Crisis', 'Debt', 'Companies', 'Economy', 'absurdity', 'money', 'World', 'market', 'Entertainment', 'Deficit', 'accounts', 'Economy', 'Failure', 'Economy', 'TradeWar', 'media', 'USA', 'Markets', 'economics', 'actors', 'Absurdity', 'Money', 'advertising', 'corruption', 'china', 'www', 'Losses', 'threats', 'Culture', 'absurdist', 'adaptation""', '""abuse', 'Amazon']","﻿1
[MUSIC]
What's going on Mr. Mariusz?
What did you hear again?
In Business Insider I read that 8 American billionaires lost almost $ 400 billion in total last year.
I wonder how you can lose such money.
They drank it, someone stole it, took it, invested badly, went bankrupt. What happened?
Good question. Because, indeed, such amounts are falling and I have seen such calculations.
Not only that, I would add that it looks even more interesting.
Because, for example, the Kilon Mask estate has decreased by more than half.
So these are not just the billions that are abstract for all of us,
but we are talking about the fact that one of the richest people in the world lost half of his property.
Literally in a dozen months.
The same goes for Jeff Bezos and many others.
We are talking about the world's largest companies.
We are not talking about, as you say, bad investments and so on.
No, no, no.
We are talking about their leading key businesses suddenly falling in value.
How do you estimate the value of such people's assets?
Taking it literally from space.
It is not based on a hard number. Someone says accounting is a very mathematical thing.
In this case, unfortunately, not at all.
Because how to estimate real estate in Manhattan?
How do you calculate it exactly?
How do we know how much it is worth?
Do you calculate the value of bricks?
No. I can compare it to the values of similar real estate sold before.
Or the needs and possibilities of people who would like to buy.
In short, we are talking about demand and sale.
This is a classic case. How much is a bottle of Coca-Cola worth?
As much as someone who buys wants to pay.
Yes. If you offer me this bottle in the desert when I die of thirst, it will be worth all the money.
It is exactly the same with these prices.
Of course, it is not as dramatic as with Coca-Cola.
But sometimes psychology plays the most important role in prices.
There are companies that are trendy.
In the style of Tesla, it happened.
And suddenly its shares skyrocketed several dozen times.
Shares that were worth $ 10-15 in 2019, then began to be worth $ 100-200-300-400.
These are absurd values.
And now the question is what happened?
For a year or two with this company, it has grown from $ 10 to $ 400 per share.
What happened? It became popular.
But what happened now? It is losing.
They started to produce something that did not go into the market.
They made a mistake. Such money does not go away for no reason.
You are right. They do not go away for no reason.
There are many reasons.
I will give one. China.
Tesla invested huge amounts of money in mega factories in China.
And then it would seem that it is a brilliant move.
Today, when there were lockdowns, strikes, and now China is closing in on the US economy,
the so-called trade war between China and the US,
at this point, this Tesla factory in China is rather a burden, a problem, than a profit.
Investors are not idiots.
Not all, but most investors are not idiots.
So they noticed it all.
For example, one detail.
The lack of battery availability.
Tension on the Taiwan-China line.
Because it may suddenly turn out that we will not have chips, we will not have batteries for all these devices.
The same with Apple.
A big strike of the factory in China.
Exactly in the Apple factory in China.
And at this point, suddenly, what is a company worth that cannot produce anything?
Because there is nowhere.
And what control does it have over it?
The answer is exactly none.
Because it is decided by the Chinese government, and what happened in China.
They have no influence on it.
That's what it's about.
This is one aspect.
The second aspect is that, what I have repeatedly signaled for years,
against the opinion of the media,
that there is a huge crisis.
Finally, what I have been saying since 2018, very loudly,
is that it is now reaching the public space.
And people say, ""Damn, there is a huge crisis.""
So, indicators of all industries are falling.
All tech industries are going down.
Of course, they are not going down so terribly, as we say here,
that, I don't know, about half and so on.
No, no, no.
But it still shows that these are symptoms of a certain threat.
Such black clouds that are gathering.
Investors also don't like it.
Because the future doesn't look bright for them.
So this is the second aspect.
Because in 2022, miracles happened.
The shares went up?
Damn.
Don't look for sense there, because it's a pity for the West.
Before you buy shares, put your head in the ice.
At this point, we will take a short break.
We will be back after a moment of music.
Music
Music
Music
Music
Music
Music
Music
Music
Music
Music
Music
Music
Music
Music
Music
Music
Music
Music
Music
Music
We're back to our broadcast.
Once again, we have Mariusz Stefaniak in front of us.
Economist, financier, president of the ""Więcej Mądrości"" Foundation.
Mr. Mariusz, what's going on?
We talked about the fact that billionaires, Americans, lost a huge fortune,
but the prices of the shares of the most famous American companies also fell.
Netflix, Disney, Amazon, Apple, Meta.
Giants, entertainment.
What's going on?
We stop watching TV.
Is this a sign of a crisis?
Has the crisis affected only a few industries?
Indeed, this has not been observed in recent years.
Needless to say, the entertainment industry has experienced a boom.
Especially in recent decades.
These were amazing years for them.
Of course, during the pandemic, cinemas were closed in the United States.
We did not feel it that way, but Americans rely heavily on the cinema network.
It's a different culture, so it works differently for them.
Big companies earn a significant part of their wealth by distributing cinema tickets.
These are hundreds of millions of dollars from one movie.
It's a lot of money, even for them.
It was a breakthrough year in 2022, because the biggest productions,
the biggest film studios stopped making money and started to bring significant losses.
We are talking about losses of $200 million.
We are talking about such amounts from one movie.
Indeed, it is shocking and there are quite a few reasons for this.
Please start counting, because I'm curious what you mean.
A classic example, which was a breakthrough example, was ""Rings of Power"" from Tolkien's world.
The previous releases from this world were the biggest hits in the history of cinema.
We are talking about screenings made by Peter Jackson.
And here, suddenly, the biggest company, Amazon, and Amazon Studio,
put out an unprecedented amount of money in the industry.
Almost a billion dollars for one movie.
This has never been seen, even in Hollywood, with the biggest productions.
What turned out?
That it was a total crushing, terrifying blow.
But it's even deeper, because they announced a success.
All the media claimed that it was an incredible success,
that it was the number one hit in the world,
that for the next few decades people would be delighted with what they had created.
But this was a violent dispute with the opinions of people like us, ordinary viewers,
and independent experts, who are not too many,
they are not particularly loud, but they are great experts,
who do not appear in mainstream media.
And there was a very brutal fight between a gigantic company,
which, to put it brutally, paid, bought, you could say, critics,
and even bought out all the companies that evaluate movies,
ranking these movies.
They just bought these products and put out the best opinions.
You understand the absurdity of this situation.
But this is the standard in the industry at the moment.
Of course, people were watching this until a moment,
when something so terribly expected came out.
It was incredibly strong here.
That people were expecting something brilliant,
and waited a few years for the production to be produced,
and they knew that the money put into it would be unprecedented,
so they were expecting something monumental, you know.
When you invest several times more money in the same product,
you say, ""Oh, this product will be much better.""
So you buy a car, you have a Skoda,
and now a Skoda will come out, which they put, let's say,
five times as much money to produce.
It comes out and you say, ""Damn, but this is a bargain,
it's not even comparable to the Skoda I had, which was five times cheaper.""
It's just a bargain.
And you get pissed off.
Alfira says, ""No, no, this is the best car in the world,
you should be happy, but I'm pissed off at you.""
And exactly that was the case.
But then a whole wave of similar situations followed.
A classic example from our backyard,
Sapkowski and Wiedźmin, one of the coolest brands
that came out of Poland and became a leading world brand in the entertainment sphere.
And again, a powerful company made a series out of it
and just destroyed, destroyed in a scandalous way
Sapkowski's brilliant creativity,
the brilliant achievement of our gaming studio,
which promoted Polish culture, history and Polish stories.
And suddenly the fans went mad.
Even the leading actor who played Geralt of Rivia left.
In a sign of protest that they were destroying,
so they were laughing, apparently, those who created this series,
they were laughing at Sapkowski's book, they were laughing at our production.
They were just getting drunk from what they had created.
You know, such absurdities.
And it's not just about the books, it's about the movies you mentioned.
We can literally go through them one by one
and you'll find out that they're just laughing at their own clients.
They say they're idiots, nerds, naive, stupid.
And you know, you can see that approach.
And people at some point stopped accepting it,
which at the same time resulted in, as we mentioned in the previous segment,
a general decline in the market.
And that's the situation we're in.
Mr. Mariusz, I think we'll discuss the topic of what's happening in mass culture,
how it affects the economy and the situation in the world
in our next meeting,
where I'm already inviting our listeners
on Saturday and Sunday at 10.30,
which is played by our guest, Mariusz Stefaniak,
economist, financier, president of the Fundacja Więcej Mądrości.
Thank you very much for the meeting and for the conversation.
Thank you very much and I also invite our listeners. Goodbye.
Goodbye, Krzysztof Strauchman.
www.tronko.pl
Other radio stations in Głuchołazy and the area 105 i 2
www.globalonair.pl"
