reference_path,summary_content,tags,transcript_content
C:/Users/G/Documents/GitHub/audycje.com.pl/content/audio\CJG_05_2023_02_11.mp3,"---

### Key Themes:
1. **Economic Regulation**: The text discusses the use of indicators such as minimum wage and maximum price, which suggest regulatory measures in the economy.
2. **Market Dysfunctionality**: There is a concern that healthy market rules are not functioning properly, indicating issues with the free market economy.
3. **Energy Prices**: The conversation highlights the absurdity of current energy prices and their disconnect from economic reality.
4. **Political Decisions and Sanctions**: The text critically evaluates political decisions and sanctions against Russia, questioning their effectiveness and impact on the economy.
5. **Socio-Economic Impact**: There is a focus on the socio-economic consequences of these policies, including bankruptcies, job losses, and the struggle of ordinary citizens to afford basic necessities like coal.

### Impacts:
1. **Economic Dimension**: The imposition of regulations and sanctions has led to economic instability, with soaring energy prices and mass company bankruptcies.
2. **Technological Dimension**: No direct technological impacts are discussed, but indirectly, the energy crisis may impact technological sectors dependent on affordable energy.
3. **Political Dimension**: Political decisions regarding sanctions and energy policies are being criticized for their lack of effectiveness and for causing economic hardship.
4. **Social Dimension**: Ordinary citizens are facing severe financial strain due to the high cost of living, with significant impacts on employment and quality of life.

### Examples and Evidence:
- **Regulations**: The mention of minimum wage and maximum price regulations indicates attempts at controlling prices.
- **Energy Prices**: The specific example of coal prices increasing tenfold demonstrates the economic burden on citizens.
- **Sanctions**: Criticism focuses on financial sanctions not working as intended, with transactions still happening through unsanctioned banks and countries like China.
- **Socio-Economic Impact**: Real-world examples include a cleaning lady unable to afford coal despite years of honest work, reflecting the broader socio-economic distress.

### Opportunities and Risks:
1. **Opportunities**:
   - There is an opportunity for economic reforms that could lead to more effective policies and better market regulation.
2. **Risks**:
   - High energy prices may continue to strain the economy, leading to further bankruptcies and job losses.
   - Ineffective political decisions could exacerbate social unrest and economic inequality.
   - The continued closure of coal mines risks long-term energy security.

### Conclusion:
The conversation reveals a critical assessment of current economic policies, highlighting the need for more effective market regulation and political decision-making. It underscores the real-world impacts on ordinary citizens and calls for a reevaluation of strategies to mitigate the economic crisis.

---","['EnergyMarket', 'Sanctions', 'Poland', 'Business', 'Europe', 'SmallBusinesses', 'economy', 'Entrepreneurs', 'entrepreneurs', 'Energy', 'Market', 'State', 'Entrepreneurship', 'regulation', 'Radio', 'CoalShortage', 'russia', 'Poland', 'Competition', 'market', 'Economy', '""Market""', 'Economics', 'Energy', 'sanctions', 'economics', 'Economy', '""Economy""', 'taxes', 'Russia', 'Business', 'regulations""', 'Market', 'Europe', 'market', 'Money', 'Economy', 'poles', 'War', '""Crisis""', 'Energy', 'regulation', 'Money', 'Business', 'business', 'anti-corruption', 'taxes', '""assistance', 'Money', 'politics', 'resources', 'Finance', 'state', 'Economy', 'Energy', 'Market', 'Crisis', 'politics', 'Income', 'Crisis', 'Crisis', 'Economics', 'Europe', 'Indicators', 'Economics', 'media', 'Business', 'market', 'energy', 'market', 'Debt', 'Weapons', 'Absurdity', 'abuse', 'Culture', 'Politics', 'Energy', 'business', 'government', 'budget', 'police', 'Crisis', 'access', 'money', 'Money', 'Rules', 'Money', 'Covid19', 'HeatPumps', 'Support']","﻿1
[MUSIC]
What's the news, Mr. Mariusz?
What did you hear again?
I found the data of the main statistical office, which concern the end of the last year.
It turns out that Poles are increasingly suspending their companies and are not in a hurry to open new ones, at least not at the pace as before.
This is how it is with the market economy, that someone will succeed, someone will fall, someone will fail.
Is the current scale of this phenomenon different from what has been happening in Poland so far?
Can it indicate something bad in our economy?
I think so.
Almost every third entrepreneur thinks about closing the company, and every second one would look for a job at the stage.
We read in the studies of the ESA Business from 2002.
Maybe I'll give a few facts.
Poles are leaders in entrepreneurship on a global scale.
For example, 78% of Poles believe that running your own business is a good idea.
This is the second highest result among 21 countries studied in Europe and the tenth among 50 countries in the world.
So we respect businessmen.
We are entrepreneurs.
Amazingly, and on a global scale.
Not only that, we like entrepreneurs.
77% of Poles believe that people who run a business and are successful should be recognized.
This is the sixth highest result in Europe.
So there is a will, there is respect, but unfortunately all these positives destroy the media.
You don't mean the Gazeta Telewizji?
I mean all of this.
In 2016, 58% wrote positively, and in 2019, after three years, only 37%.
It's a drop by half.
These are the studies from CBOS.
This shows what's going on.
Poles are an incredibly entrepreneurial nation.
We respect entrepreneurs, but the sudden external factors are disturbing us.
But you're not suggesting that the media are running a campaign that is aimed at entrepreneurship.
No, I have no evidence for that.
I'm talking about facts, not speculations or assumptions.
I'm talking about facts.
These are the facts.
But a Polish entrepreneur is strong enough not to care about media reports and just does his own thing.
I'm convinced of that.
That's right, but again, more data.
In 2019, only 6% of Poles wanted to start a company in the next three years, so until 2022.
And this is a result half lower than the average European.
So suddenly, from the leader, we fall into people who don't want to start a business.
Not that they don't want to.
So we're much worse off than the average in Europe.
This must show some disturbing trends.
Because I have some great, positive data.
For example, Poles outnumber the average European in the number of existing, already mature businesses.
So about 13% to 8% in Europe.
So almost twice as much.
But again, in all other aspects, young, new and established businesses, we fall below the average European again.
These are really disturbing data.
For the last 9 years, the index of young companies has decreased from 9% to 5.4% in Poland.
While the index of mature companies has increased from 5% to 12.8%.
I suspect that it's the income that decides.
Mature companies have a good situation and earn well, while young ones, unfortunately, have a hard time.
That's why no one wants to start them.
But why in Europe and other countries it's not like that?
Maybe they use more support from the surrounding, generally the state.
I suspect that it's exactly as you said.
Because, as far as I remember, Poland is in second place in Europe and 10th in the world among the countries with the most complex business rules.
So it's the Global Business Complexity Index 2021.
So we are in the lead, where it's the most difficult to run a business.
And we're talking about 10th place in the world, 2nd in Europe.
So we're at the very bottom when it comes to conditions.
Which, as you rightly noticed, may lead to the fact that we want less and less.
In addition, as we said, the media do not encourage the introduction, do not build a positive image of a businessman.
The same is confirmed by the so-called National Index of Entrepreneurship Conditions, where we are at the very end.
15th place out of 22.
Well, that's not encouraging.
Funny.
Do you know who is in first place?
Romania? Bulgaria?
No, Switzerland.
Because it's the best there.
That's why rich countries have much higher indicators, so it's better to run a business there.
Where it's bad to run a business, unfortunately, the indicators will be low.
I will only add that Poland got the same points as Belarus.
And it's better to leave it without comment.
And, above all, there are also modern or current two years of difficulties related to energy increases.
But we'll come back to this topic after the break.
AMEN
AMEN
AMEN
AMEN
AMEN
AMEN
AMEN
AMEN
AMEN
AMEN
AMEN
AMEN
AMEN
AMEN
AMEN
AMEN
AMEN
AMEN
AMEN
AMEN
AMEN
AMEN
AMEN
AMEN
AMEN
AMEN
AMEN
AMEN
AMEN
What's up, Mr. Mariusz? We're talking with Mariusz Stefaniak,
the president of the ""More Wisdom"" Foundation, an economist and a financial expert.
Today, we're talking about small businesses.
Mr. Mariusz, the logic indicates that countries with a lot of income,
countries that make a lot of money, should create the best, the easiest conditions for small business development.
Taking into account that small and medium-sized businesses are a very important part of our national product.
Why is it not so? Why is it easier to run a business in a rich Switzerland?
You've brought up a great topic.
The answer is simple.
The Swiss like Swiss companies and the Swiss government promotes Swiss companies.
In Poland, the government and regulations hate Polish companies, Poles running companies.
I'll give you a simple example.
The tax on CIT is only 0.004% of the company's income, which is less than 0.5%, not 19% as the Polish companies pay.
What kind of business will fall at higher costs in a smaller market, with fewer customers, etc.?
It's obvious.
Instead of paying 1.8 million CIT taxes, Osho should pay 510 million taxes.
If you list all the years of activity, and count the dozens of such huge businesses,
it turns out that Poland would be mega-rich, not mega-involved.
On the other hand, Mr. Mariusz, I also came across some data,
which shows that in 2021, public assistance provided to various companies,
including Polish TV, amounted to PLN 76 billion.
That's over 10% of our annual budget.
Among other things, 300,000 small companies benefited from this assistance.
It was mainly about various Covid shields.
So what? On the one hand, we prefer big companies, and we give money to small ones.
This is some kind of double-crossing.
Let's ask where this assistance comes from.
Do you know that you have been working for half of your life for Danina?
And as an economist, I don't want you to give me anything,
just stop taking it from me.
Then people who are smart and hard-working will live well,
and not stupid and lazy.
Let's promote those who know how to do something,
not those who don't know how to do something.
But we live in a time when there are more and more state regulations,
and society simply demands them.
Yes, because politically it is well seen,
but economically it is not necessary.
Speaking of assistance, I can give examples that I know.
Orange, according to the ZPP analysis,
in 2015-2019, for every zloty of the tax paid,
received almost 10 zlotys of public assistance.
Orange, sir, is a French company.
And it's gigantic.
That's why I say that all foreign companies are economically harmful
for the Polish economy for a long time,
but beneficial for Polish politicians.
And one day I can justify it.
But we are in the European Union, we cannot eliminate someone
because he is a foreign capital.
In the European Union, equality of rules applies.
I'm not talking about eliminating.
I'm just saying not to promote,
not to finance,
not to give incredible benefits.
Why do foreign companies have tax benefits,
as I have given, for example?
They practically do not pay any taxes.
I can give examples that this is a joke or a joke for us,
for Polish entrepreneurs.
They get public assistance from the Polish budget.
And how much did you get in your life from this public assistance?
I managed various companies and believe me,
I never got any public assistance from any company.
For decades of running, even large companies, small companies.
In my opinion, you should all create equal rules of action
and equal support or just its lack.
Let everyone deal with the market alone.
It would be fair if there were no special preferences,
tax relief, financing and so on for foreign companies,
which I claim are harmful to us.
And besides, it means that you can't compete with foreign companies,
markets, entities.
You simply have no chance.
You have no chance of competing with them.
And such an Orange or Sean will always crush Polish competitors,
because they get an incredible bonus, sir.
Well, they start from a much higher trap,
because they are big, strong companies that enter the market.
No, please forgive me, but again,
I personally, professionally, came across powerful Polish companies
that were destroyed, such as Optimus, SA, sir,
which was the largest European IT company.
Such a Polish Microsoft.
And you know what happened?
The rules were imposed on him,
and ultimately, the owner of Optimus won.
They turned out to be illegal, that's right.
Yes, yes, of course.
Mr. Roman Kluska, who now seems to be a sheep and has enough business.
Well, you know, that's how it ends for Polish companies that were successful.
Look at the business of Mr. no longer alive Gołębiowski.
A gigantic entrepreneur with great success and so on.
He is dead, he did not survive what was done to him.
The police physically murdered him.
I can say that, boldly.
So, you know, there are many examples.
One more break, we'll be back in a moment
with the topic of regulation on the energy market for entrepreneurs.
[music]
[music]
[music]
What is played, Mr. Mariusz, part 3.
Our interlocutor is Mariusz Stefaniak, financial economist.
We are talking about the situation of small companies.
For a year, a very serious problem for small companies are energy prices.
Coal prices, electricity prices have increased many times.
Many businesses are closing for this reason.
He just can't survive it.
We were talking about the fact that there should be clear, clear rules on the market.
But should the energy market be regulated by the state in this case?
Or should it be left in the invisible hand of the free market?
Interesting question, because there is no clear answer to it.
First of all, the energy market is one of the strategic sectors for the state.
So it can be one of the factors that threaten the sovereignty of a given state.
So I can't imagine it not being controlled by the state in any way.
Because it is too neurological part.
Secondly, if we leave it in the hands of, let's be honest, politicians,
I don't see it either.
So I'll put it this way, it would be best if it was regulated by healthy free market rules,
but with supervision that controls the security of the state.
That's how I would put it.
And we are dealing with such control.
The state has introduced regulations on the maximum prices for people, for municipalities, for self-governments,
for so-called sensitive entities.
Should these prices be regulated also in the enterprise sector?
Or should the business simply buy at the market price?
I don't agree with these regulated prices at all.
Because that's where the evil is, in my opinion.
If you see any economic indicator, minimum wage, maximum price,
you know that something is wrong with this economy.
Because it means that healthy market rules don't work there at all.
If you look at the free market economy, if it was American, it was, because it is not anymore,
they didn't have such regulations.
You practically had free market everywhere.
There was a low fuel price there, yes, but it wasn't, as we say here,
that some maximum for some group.
No, no, no, no, the state just didn't make money on this fuel in general,
because it's great for the economy.
Low fuel prices, low energy prices, it's great.
These prices are absurd, sir.
They have nothing to do with the economic reality.
Well, yes, now they were very high.
It is known that the government earns on fuel, on excise, on cotton wool,
from which it was withdrawing from time to time.
Well, Mr. Mariusz, but it was and it is.
The war caused in Ukraine that these prices were skyrocketing in an unimaginable way.
Well, I would definitely not agree with that.
No war caused it.
This is a fact and that's it.
It's hard to even discuss it.
Suddenly we were short of 10 million tons of coal that we imported from Russia,
and which we decided not to import.
Suddenly we were offended by the supply of coal from Russia.
I mean, we used it and we're just getting out of it now.
Well, a lot has changed on this world market.
You're right.
The things I've mentioned are true, but your interpretation is not true.
Well, I'm listening.
So we stop importing, we stop receiving energy fuel on such a scale.
But this is our own decision, not related to any war.
So it didn't go up because of the war,
but because of the decisions of specific people, political decisions.
Because we are not in a state of war with Russia, as you may not know.
So I don't see any contradictions sent to the point of not keeping in touch with them.
We are at the stage of economic restrictions in relation to Russia.
But these are political decisions, sir.
Not only that, these are decisions of hypocrites.
On the one hand, sanctions are being mentioned against Russia,
and on the other hand, these sanctions are not working.
Never in any aspect.
Financial sanctions, sir, I say this as an economist,
are a concrete nonsense, it's a fake, a media fake.
Because I know at least a few Russian banks that function normally.
So we disliked a few banks, so that it looked good in the newspapers,
but those banks that are ""under sanctions""
are pushing their stuff through those that are not under sanctions.
And all the billion-dollar transactions Russia is pushing through,
just check what I'm saying, through Chinese banks.
Where are these sanctions?
Same with fuel, same with coal.
Now, just so you know, there are gigantic purchases of Putin's coal
through many countries, sir.
Do you think that what they will do with this coal?
That the miners will put it together? They will sell it to us at high prices.
But the Poles are really paying for this media hype, sir.
For these fictional pseudo-sanctions.
Right now, because of our political decisions,
the bankruptcy of companies,
massive bankruptcies of Polish companies, sir.
In a moment, when you get the data, you will say,
""Oh, it's bad."" No, it's not bad.
It's tragic, sir.
And now I also have such data,
that in some shops, half of the turnover is falling, sir.
Half! Not 10%, not 20%. 50%!
Why don't people have money, sir?
I had a case with a lady,
who worked at a cleaning company.
I talked to her for a moment.
And she said, ""Sir, I've just put on gas,
even though I know it's expensive,
that it costs money, etc.
But when they tell me that I have to pay 20,000 for coal for the heating season,
I don't have that money!""
Do you understand? I'm talking to a normal person.
This lady has been working honestly for years,
and she can't afford to buy coal.
In a country that is a potentate of coal.
It's a nightmare.
And now, we've closed most of our coal mines, sir.
And now, again, we don't want to buy coal from bad Russians, really.
What are we supposed to do? Die of hunger? Cold?
What do we gain from this, sir? That we're offended by Putin?
I understand that we can be offended by Putin,
when we have our own coal mines,
and then, okay, we don't buy anything,
we increase the production in our mines three times.
But we don't have anything to increase, because we don't have a mine!
Because we've just closed them!
And do you know how much a ton of coal from a Polish mine cost?
Before the crisis? A year ago or two years ago?
Well, within the limits of 300-400 zlotys.
Now, 3000.
No! 200-250.
Well, a tenfold difference, anyway.
I understand, sir, we pay 10 times more.
Why? Let him tell me what the reason is, because I don't know the reason.
Mr. Mariusz, it's time to finish our broadcast,
but we're already cutting to the next topic,
to the next episode,
what's happening with Polish coal,
what's happening with coal in general.
Thank you very much for today's conversation.
Our guest was Mariusz Stefaniak,
the president of the ""Więcej Mądrości"" foundation,
an economist, a financier.
Thank you, Krzysztof Strauchman.
Other radio stations in Głuchołazie and the area 105.2
and the area 105.2
PARROT TV"
