reference_path,summary_content,tags,transcript_content
C:/Users/G/Documents/GitHub/audycje.com.pl/content/audio\CJG_03_2023_01_28.mp3,"### Key Themes

The text discusses several interconnected themes:
1. **Film Industry Standards**: The comparison between previous films by Peter Jackson and the new adaptation of ""The Ring of Power"" highlights disparities in critical reception and audience satisfaction.
2. **Diversity and Inclusion**: The presence of black actors, homosexuals, and transhuman characters in fantasy movies is explored, with a focus on how these inclusions are perceived by audiences.
3. **Ideological Influences**: The impact of political and ideological agendas on the selection of cast and crew, reminiscent of historical practices like the appointment of political commissars.
4. **Audience Backlash**: The frustration and rebellion of fans due to perceived forced diversity and poor quality content driven by ideological motivations rather than artistic merit.

### Impacts

The broader impacts of these themes include:
1. **Economic**: Financial investments in films are at risk when audience reception is poor, as seen with ""The Ring of Power"" where viewership had to be incentivized.
2. **Technological**: No direct technological impact is mentioned, but the discussion could influence future content creation practices and platforms' strategies for audience engagement.
3. **Political**: The text hints at a politicization of the film industry, with certain ideologies influencing casting decisions, which can polarize audiences.
4. **Social**: The inclusion of diverse characters should foster social acceptance but can backfire if not handled authentically, leading to accusations of tokenism and poor representation.

### Examples and Evidence

Real-world examples include:
1. **Critical Reception Disparity**: The stark difference in ratings between Jackson's previous films (91% critic, 95% viewer) and ""The Ring of Power"" (38% viewer, 85% critic).
2. **Viewership Incentives**: Amazon paying viewers to watch due to poor initial reception indicates a failure in engaging audiences organically.
3. **Historical Parallels**: The comparison with political commissars highlights how ideological conformity can supersede artistic merit.
4. **Audience Rebellion**: Fans rebelling against perceived propaganda and low-quality content due to ideologically driven casting choices.

### Opportunities and Risks

Opportunities:
1. **Inclusive Storytelling**: Authentic inclusion of diverse characters can enrich stories and broaden audience appeal.
2. **Audience Engagement**: Better understanding and addressing audience expectations can lead to more successful productions.

Risks:
1. **Ideological Backlash**: Forced diversity and ideological conformity risk alienating audiences and leading to backlash.
2. **Financial Losses**: Poorly received films can result in significant financial losses, as seen with ""The Ring of Power.""
3. **Creative Constraints**: Prioritizing ideology over artistic merit may stifle creativity and limit the potential of productions.

### Conclusion

The implications suggest a need for balance between diversity and authentic storytelling. Producers should focus on selecting cast and crew based on talent rather than ideological fit. Future considerations should include better audience research to understand what viewers expect from inclusive content, thereby avoiding potential backlash and ensuring financial viability. Achieving this balance will likely result in more successful productions that authentically represent diverse experiences while maintaining high artistic standards.","['radio', '""actors', 'World', 'World', 'world', 'EndOfWorld', 'endoftheworld', 'woke', 'filmindustry', 'Movie', 'actors', 'critics', 'ideologies', 'End', 'Film', '""amazon', 'cinema', '""tvseries""', 'Economics', 'Ideology', 'filmindustry', 'woke', 'Propaganda', 'oppression', 'Money', 'ideology', 'BoxOffice', 'Film', 'Politics', 'apocalypse', 'apocalypse', 'propaganda', '""productioncosts""', 'economy', 'Apocalypse', 'Apocalypse', 'Power', 'War', 'Economy', 'hollywood', 'cinema', 'politics', '""amazon""', 'Rating', 'views""', 'directors', 'failure', 'movies', 'financialresults', 'Culture', 'Crisis', 'Doomsday', 'Crisis', 'earnings', 'culture', 'media', 'ideology', 'region', 'ideology', 'advertising', 'money', 'entertainment', 'investors', 'absurdity', 'Amazon', 'diversity', 'Economy', 'culture', 'Aging', 'Fantasy', 'Money', 'Economy', 'Market', 'implementation', 'Economics', 'absurdity', 'amazon', 'funding""', 'Money', 'Culture', 'Amazon']","﻿1
[MUSIC]
What's the deal, Mr. Mariusz?
What did you hear there again?
To be honest, I was inspired by our conversation from a week ago
about how unsuccessful TV series produced in recent or previous years
affect the course of action of large companies producing movies.
I started looking for data on the Internet about the number of viewers and ticket inflows
of the famous series ""The Ring of Power"".
While Amazon, the producer, boasted a lot before the distribution of this series
how much it invested in its production,
that it cost a record $1 billion in the history of cinema,
it's hard to find enough data about how much it earned.
Is it a sign that the movie was a financial flop?
It doesn't necessarily have to be a sign, but it gives a disturbing signal.
That something is wrong.
If we have something to boast about, why don't we boast?
Because we are modest.
No, we know that Amazon Studio and Jeff Bezos are not modest people.
They love to boast about their successes, their numbers, achievements.
So it makes you think. You're right.
Especially since in previous series or movies that were cash successes
they were officially stated how much they earned
and they earned several times more than their production cost.
This one should earn several billion dollars.
Yes, it definitely is.
There were even announcements, sometimes even a little exaggerated,
because they claimed that 60 years after the release of ""Rings of Power""
it will be a hit and people will watch it.
So I think it will be a mega hit for decades.
And as you mentioned, the very look at the predecessor sets a high bar.
For example, in 2004, ""The Lord of the Rings"" won 11 Oscars.
So in all categories nominated.
It's impressive.
All three parts won 30 nominations, of which 17.
So let's admit it's a high bar.
In terms of money, money is also impressive.
Let's say that for the invested 93 million dollars in ""Fellowship of the Ring""
which is the first part,
this part earned something over 377 million dollars.
And it was the same with every other part.
The first trilogy earned about 300-380 million dollars.
Every part.
There were also additional parts, extended versions, etc.
Each of them also earned millions of dollars.
The same with ""The Hobbit"", which was the smallest part
and also artificially divided from one book into a trilogy.
It also earned an average of 250 million dollars per part.
These are gigantic amounts.
We're talking about the fact that from a small amount of money
the company earned a billion dollars from the tickets themselves.
Where they invested 90 million dollars for the film.
It's impressive, let's be honest.
So the expectations for ""Rings of Power"" were gigantic.
Mr. Mariusz, we should start with the explanation.
We owe it to our listeners.
The point is to show why the film industry is different from other types of industries.
Steel production, car production.
What is this business different from? Why is it so important?
A good question.
It's important because of the amount of money in the media business.
Entertainment, as they call it.
Broadly speaking, entertainment.
But the key to the puzzle is not here.
Because it's a socially important business.
Because it shapes people's minds and views.
Which affects all their life decisions.
It shapes the whole country and society.
And the powers of this world know it perfectly and use it effectively.
So it's about power and propaganda.
Not just about pure money.
He called it a bunch of crap, but it's true.
It's about power and propaganda.
We'll take a break and be back in a moment.
PARROT TV
PARROT TV
PARROT TV
PARROT TV
Parrot Shop
Parrot TV
Parrot Shop
Parrot Shop
Parrot Shop
Parrot Shop
Parrot Shop
Parrot Shop
Parrot Shop
Parrot Shop
Parrot Shop
Parrot Shop
Parrot Shop
Parrot Shop
Parrot Shop
Parrot Shop
Parrot Shop
Parrot Shop
Parrot Shop
Parrot Shop
Parrot Shop
Parrot Shop
Parrot Shop
Parrot Shop
Parrot Shop
What's up, Mr. Mariusz?
Our guest is Mariusz Stefaniak,
president of the ""Więcej Mądrości"" foundation,
financial economist.
And the topic of our conversation today is
the situation of the film industry
and how successful or unsuccessful productions
affect the financial results of companies.
But not only. Mr. Mariusz, we talked about
the ""Ring of Power"" series
produced by Amazon.
And what is it like compared to other superproductions
from the last year?
Did they also make such spectacular hits?
Well, the answer is not unambiguous.
Because I personally found a common denominator
that perfectly shows
when something will be a hit
and when it will be a success.
What were the gigantic hits?
The ""Ring of Power"" series
is definitely at the top.
Because it was a breakthrough
on many levels of the phenomenon.
What else was so incredibly unsuccessful?
Undoubtedly, ""The Witcher"".
Sarah the Witcher,
who is known and loved
all over the world,
was so terribly disfigured
that the audience
was massively running away.
Including the main character,
Henry Cavill,
who simply gave up
the gigantic money
he earned there.
This is, of course, a classic example
of Star Wars,
one of the biggest sagas
in the history of cinema,
which, from part to part,
was an increasing disappointment.
It also led the audience
to fury.
What was done with this great title.
A great universe
created by George Lucas.
But of course,
it is not so unambiguous.
Because there are the freshest productions.
""Maverick"" with Tom Cruise,
which is a great success.
""Avatar"", which earns billions
at the same time as other companies
lose billions.
So what is the common denominator
of all these films?
Exactly. That's why I asked myself
such a question, analyzing the economic results.
And you know what I came to?
The answer is simple. Ideology.
Ideology is a common denominator, sir.
These films were dominated
by ideology?
Yes. And this specific ideology.
In Poland we do not have
such a word, but in the West
it is called ""woke"". ""Wokeness"".
Well, I heard. It is also penetrating into Poland.
It is slowly adapting
to the current situation.
And this is the key word
to the mystery of economic failures
or profits.
There is such a famous saying
now, a real meme.
""Get woke, go broke"".
So stay woke, i.e. enlightened
and go bankrupt.
The film and entertainment industry
in particular
is a carrier
of certain cultural values.
These richest people,
who actually run these companies.
Let's be honest,
no one poor and average has a film studio
in Hollywood.
And they randomly launch
certain ideologies.
And these ideologies say
that it is a beautiful ideology.
Something like communism.
That everyone is equal.
That we must help people who are excluded.
Who are in the minority.
Who do not have such a voice as you.
Great ideals, right?
Well, the ideals of equality
were always very eagerly heard
and promoted.
And what is the practice of implementing these ideals?
I found a short definition
of the woke ideology.
That it is not equality, but it is an obsession.
Obsession on the point of gender,
on the point of sexual orientation
or climate change.
So this is something that is totally
overwritten.
Yes, because at the beginning
all ideologies, if you look at the history
of the communist era, we want
the oppressed workers not to be oppressed.
That these great scammers
were not such tyrants.
They did not steal people.
After all, we want everyone to live better.
Beautiful.
But let's look at the implementation
of this in practice.
Hundreds of millions of victims,
destroyed houses, culture, society,
bloody slaughter.
This is what the implementation of these beautiful slogans
looks like in practice.
We will come back to you in a moment.
""The end of the world is not the end of the world.
It is the beginning of the end of the world.
It is the beginning of the end of the world.
It is the beginning of the end of the world.
It is the beginning of the end of the world.
It is the beginning of the end of the world.
It is the beginning of the end of the world.
It is the beginning of the end of the world.
It is the beginning of the end of the world.
It is the beginning of the end of the world.
It is the beginning of the end of the world.
It is the beginning of the end of the world.
It is the beginning of the end of the world.
It is the beginning of the end of the world.
It is the beginning of the end of the world.
It is the beginning of the end of the world.
It is the beginning of the end of the world.
It is the beginning of the end of the world.
It is the beginning of the end of the world.
It is the beginning of the end of the world.
It is the beginning of the end of the world.
It is the beginning of the end of the world.
It is the beginning of the end of the world.
It is the beginning of the end of the world.
It is the beginning of the end of the world.
It is the beginning of the end of the world.
It is the beginning of the end of the world.
It is the beginning of the end of the world.
It is the beginning of the end of the world.
It is the beginning of the end of the world.
It is the beginning of the end of the world.
It is the beginning of the end of the world.
It is the beginning of the end of the world.
It is the beginning of the end of the world.
It is the beginning of the end of the world.
It is the beginning of the end of the world.
It is the beginning of the end of the world.
It is the beginning of the end of the world.
It is the beginning of the end of the world.
It is the beginning of the end of the world.
It is the beginning of the end of the world.
It is the beginning of the end of the world.
It is the beginning of the end of the world.
It is the beginning of the end of the world.
It is the beginning of the end of the world.
It is the beginning of the end of the world.
It is the beginning of the end of the world.
It is the beginning of the end of the world.
It is the beginning of the end of the world.
It is the beginning of the end of the world.
It is the beginning of the end of the world.
It is the beginning of the end of the world.
It is the beginning of the end of the world.
It is the beginning of the end of the world.
It is the beginning of the end of the world.
It is the beginning of the end of the world.
It is the beginning of the end of the world.
It is the beginning of the end of the world.
It is the beginning of the end of the world.
It is the beginning of the end of the world.
It is the beginning of the end of the world.
It is the beginning of the end of the world.
It is the beginning of the end of the world.
It is the beginning of the end of the world.
It is the beginning of the end of the world.
It is the beginning of the end of the world.
It is the beginning of the end of the world.
It is the beginning of the end of the world.
It is the beginning of the end of the world.
It is the beginning of the end of the world.
It is the beginning of the end of the world.
It is the beginning of the end of the world.
It is the beginning of the end of the world.
It is the beginning of the end of the world.
It is the beginning of the end of the world.
It is the beginning of the end of the world.
It is the beginning of the end of the world.
It is the beginning of the end of the world.
It is the beginning of the end of the world.
It is the beginning of the end of the world.
It is the beginning of the end of the world.
It is the beginning of the end of the world.
It is the beginning of the end of the world.
It is the beginning of the end of the world.
The previous iteration of Peter Jackson's beloved movie had a rating level, I quote here from one of the most famous and respected rating portals, 91% in the critic's rating and 95% in the viewer's rating.
So practically perfect, almost perfect, almost everyone was delighted.
Let's put it together with the Ring of Power, sir. You have 38% here for the plus from the point of view of the viewers and 85% of the critics.
Of course, it came out very brutally, because people say that the critics are blind, they did not watch the same as we did.
It turns out that these are just bought reviews.
Brutally. In addition, there were such paradoxes that Amazon began to buy viewers in some countries to start watching, because the results of the viewing were so terrible, they are so terrible that for a whole week they were not published at all.
And people watched individual episodes.
They started paying viewers for watching because the results were so terrifyingly terrible.
This is something incredible in the film industry. That you pay the viewer to want to see what you have produced, because you want it to be a success so much, and it is such a big failure.
Mr. Mariusz, but we live in an open society, the presence of black actors on the screen, the presence of homosexuals or people playing homosexuals in films is no longer surprising anyone.
What is it about? Why is this a problem for the audience?
I agree, I absolutely agree with you, because I have not heard any opinions that someone has interfered with the fact that someone has put black elves in the Legendarium or black transhuman women and so on.
I have not heard such negative opinions.
But I have heard opinions that, for example, bad actors, bad showrunners, bad directors, bad bosses of studios were put in, because they are elected from the political, ideological key.
It reminds me of the times of political commissars in the socialist union, who, no matter how competent they were as managers or commanders, they always had a decisive voice.
They force people with low competences into us, because they fit the ideology or the denominator, how many percent are supposed to be homosexuals in the film.
Because that's exactly what the percentages are.
How many people are supposed to be of a certain skin color, of a certain minority?
Nobody cares if they are great actors, hopeless or average.
They have to be there, because otherwise the film will not be funded.
And this is really something that drives people mad.
Because not only do they put in weak actors, but if you don't like the film, you'll be called a racist.
And a lot of other adjectives.
And this is exactly what led to, you can say openly, the rebellion of fans, the rebellion of viewers, because they just want good shows.
And not ideological, propaganda, poor quality videos.
That's what it was about.
We have to finish our conversation.
Our guest was Mariusz Stefaniak, president of the ""Więcej Mądrości"" Foundation.
A financial expert, an economist.
Mr. Mariusz, thank you.
Thank you very much.
The conversation was led by Krzysztof Strauchman.
And we invite you next week on Saturday and Sunday at 10.30 to ""Inne Radio"".
""Inne Radio"" in Głuchołazie and the area 105,2.
""Inne Radio"""
